"QUESTION","ANSWER_A","ANSWER_B","ANSWER_C","ANSWER_D","ANSWERS","IMAGE"
"Kuo kvantinis kompiuteris iš esmės skiriasi nuo klasikinio kompiuterio?","Jis naudoja šviesolaidžius dvejetainių kodų perdavimui vietoje elektrinių varinių laidų ir tranzistorių.","Jis naudoja ne tradicinius tranzistorius, o veikia atomų lygmens dalelių kvantinės mechanikos (superpozicijos, susietumo) principais.","Jis veikia kambario temperatūroje naudodamas analoginius vakuuminius vamzdžius didelio greičio skaičiavimams.","Jis pagrįstas išimtinai Niutono fizikos dėsniais, visiškai eliminuojant bet kokius atsitiktinumus ar tikimybes skaičiavimuose.","B",""
"Kurie chronologiniai etapai ir pasiekimai kvantinės kompiuterijos raidoje suporuoti teisingai? (Pasirinkite visus teisingus atsakymus)","1994 m. – Peter Shor sukūrė pirmąjį kvantinį algoritmą (skaidymas į pirminius daugiklius).","2011 m. – IBM išleido 433 kubitų Quantum System One kaip pirmąjį komercinį žaidimų kompiuterį.","2019 m. – Google AI ir NASA paskelbė pasiekę „kvantinį pranašumą“ (quantum supremacy) su Sycamore procesoriumi.","1913 m. – Max Planck pademonstravo pirmąjį veikiantį 2 kubitų kompiuterį vakuume.","A,C,E",""
"Ką fizikoje ir kvantinėje kompiuterijoje reiškia „superpozicijos“ (superposition) savybė?","Reiškinys, kai dvi dalelės atsitrenkia viena į kitą ir anihiliuoja, išskirdamos fotoną.","Savybė, kuri padvigubina elektros srovės stiprį superlaidžiose grandinėse.","Savybė, leidžianti kvantinei dalelei ar kubitui būti keliose būsenose (pvz., ir 0, ir 1) vienu metu, kol neįvyksta matavimas.","Būsena, kuomet procesorius pilnai praranda duomenis ir veikia kaip klasikinis kompiuteris.","C",""
"Kaip vadinasi kvantinis reiškinys, kai vienos dalelės būsena griežtai priklauso nuo kitos dalelės būsenos, neatsižvelgiant į atstumą tarp jų (pvz., dėžutėse su mėsainiu ir bulvytėmis)?","Bangų-dalelių dualumas (Wave-particle duality)","Kvantinė interferencija (Interference)","Kvantinis atkaitinimas (Quantum annealing)","Kvantinis susietumas (Entanglement)","D",""
"Remiantis Feynman'o dviejų plyšių eksperimentu (bangų-dalelių dualumas), kas nutinka dalelių (pvz., elektronų) srautui, jeigu eksperimente pridedamas „stebėtojas“ (observer), matuojantis pro kurį plyšį lekia dalelė?","Dalelių greitis eksponentiškai išauga ir jos pradeda laužti šviesos greičio limitus, atspindėdamos interferenciją.","Dalelės praranda bangos savybę, dualumas redukuojasi ir dalelės lekia tik pro vieną iš plyšių, formuodamos standartinį dalelių pėdsaką ekrane be interferencijos rašto.","Dalelės tampa susietos viena su kita (entangled) ir vizualiai pradingsta iš eksperimento ekrano, įveikdamos izoliacijos barjerą.","Stebėtojo buvimas sukuria dar stipresnę kvantinę superpoziciją ir ekrane atsiranda tris kartus daugiau interferencijos linijų.","B",""
"Kokios loginės prielaidos išsakomos „Skeptikų“, argumentuojant, kad kvantinis kompiuteris niekada realiai neveiks? (Pasirinkite visus teisingus atsakymus)","Didesnių kvantinių mechanizmų negalima sukurti, nes plečiant sistemą prarandama kvantinė mechanika (dekoherencija).","IBM ir Google slopina kvantinių tyrimų plėtrą patentuodami visas įmanomas atviras superpozicijos formules.","Neįmanoma visiškai panaikinti triukšmo sistemose.","Kvantinė fizika nėra pilnai suprantama, o realus pasaulis yra fundamentaliai diskretus.","A,C,D",""
"Kaip matematiškai kubitų kiekis (N) koreliuoja su jų atstojamų klasikinių būsenų erdve superpozicijoje?","N kubitų padvigubina klasikinį bitų srautą, tad saugo 2 x N būsenų.","N kubitų superpozicijoje vienu metu atstoja ir gali saugoti 2^N klasikinių būsenų erdvių.","N kubitų gali saugoti lygiai N^2 būsenų.","Kubitų skaičius ir erdvė yra tiesiogiai proporcingi, 10 kubitų atstoja 10 klasikinių būsenų.","B",""
"Analizuojant Blocho sferą ir kubito banginę funkciją |ψ⟩ = α|0⟩ + β|1⟩, ką tiksliai atspindi koeficientai α ir β?","Jie apibrėžia fizinį elektronų sukimosi (spino) greitį matuojamą metrais per sekundę.","Tai yra loginiai vartai, kur α yra Pauli-X, o β yra Pauli-Z matricos faktorius.","Jie išreiškia matavimo rezultatų tikimybes, kur |α|^2 yra tikimybė pamatyti 0, o |β|^2 – tikimybė pamatyti 1 (bendra suma lygi 1).","Jie nurodo atstumą, kuriuo atitolę du susieti (entangled) kubitai fizinėje vakuuminėje sistemoje.","C",""
"Kokia yra loginio elemento Pauli-X (arba X vartų) funkcija kvantinėje grandinėje?","Jis sukuria tobulą superpozicijos būseną dalinant tikimybes per pusę.","Jis susieja du kubitus, sukuriant entanglement (susietumo) būseną sistemoje.","Tai kvantinis atitikmuo klasikiniam NOT elementui – jis apverčia kubito būseną (pvz., iš |0⟩ į |1⟩ ir atvirkščiai).","Jis matuoja kubitą, nedelsiant sunaikindamas banginę funkciją ir paversdamas ją grafiku.","C",""
"Kuris kvantinis elementas (logic gate) pavaizduojamas matrica turinčia reikšmes 1/√2 [1 1; 1 -1] ir yra atsakingas už perėjimą iš bazinės būsenos į superpoziciją?","Hadamard (H) elementas","Pauli-Z (Z) elementas","Toffoli (CCNOT) elementas","Controlled Not (CNOT) elementas","A",""
"Koks pagrindinis technologinis iššūkis siejamas su „Superconducting circuits“ (superlaidžių grandinių) kubitų tipu, kurį naudoja Google ir IBM?","Superpralaidumui užtikrinti ir triukšmui sumažinti reikalinga ekstremaliai žema temperatūra (apie -273 °C).","Jiems reikalingi nuolatiniai radioaktyvūs lazeriai, todėl kompiuteriai spinduliuoja žmogui pavojingą radiaciją.","Jie yra per daug stabilūs, todėl neįmanoma atlikti „išvedimo“ procedūros (matavimo) – kubitai niekada nepraranda superpozicijos.","Šie kubitai veikia tik atvirame kosmose, nes Žemės magnetinis laukas akimirksniu sunaikina Josephson junction.","A",""
"Kas iš žemiau išvardintų apibūdina „Ion traps“ (jonų spąstų) technologijos veikimo principą?","Kubitas formuojamas naudojant fotonus, kurie keliauja šviesolaidžiais, nes jie neturi masės ir nereikalauja aušinimo.","Metalo juostelės atšaldomos iki absoliutaus nulio, kur elektronai laisvai keliauja per 1 nanometro tarpą.","Sistemoje naudojamas DNR molekulių susipynimas skysčio terpėje, kurioje fermentai atkartoja loginio NOT veiksmus.","Elektromagnetiniame lauke, vakuume, yra pagaunami atomai (jonai), kurių krūvis (būsena) keičiamas ir nuskaitomas naudojant lazerio impulsus.","D",""
"Kodėl kvantiniai skaičiavimai (programos vykdymas) dažnai kartojami daugybę (pvz., tūkstančius) kartų?","Matavimo momentu rezultatas yra atsitiktinis (tikimybinis). Norint gauti patikimą atsakymą, operacija kartojama, kad būtų surinktas tikimybinis pasiskirstymas ir identifikuotas dažniausiai pasikartojantis (teisingas) atsakymas.","Tai privaloma V-Sync sinchronizacijos taisyklė – kiekvienas kubitas turi būti atstatytas į pradinę |0⟩ būseną prieš sekantį taktą.","Kvantiniai kompiuteriai veikia tūkstančius kartų lėčiau už klasikinius, todėl vienas praėjimas niekada nespėja apdoroti pilno masyvo.","Kompiliatorius generuoja atminties nuotėkius (memory leaks), tad programa turi būti nuolat perkraunama apdorojimui.","A",""
"Skaidrėse minima išvedimo (matavimo) problema. Kokia jos esmė?","Matavimas automatiškai pakeičia kodo algoritmą, paverčiant kvantinį kompiuterį neprognozuojamu ir užkrėstu virusais.","Nors kompiuteris sistemos viduje gali atlikti milijonus lygiagrečių skaičiavimų superpozicijoje vienu metu, atlikus matavimą galima pamatyti tik vieną, vienintelį atsitiktinai sugeneruotą būsenos rezultatą.","Matavimo prietaisai (ekranai) yra pritaikyti tik dvejetainei sistemai, todėl monitoriuose neįmanoma parodyti kubitų spalvų variacijų.","Procesorius nesugeba perduoti informacijos atgal į RAM atmintį dėl per lėto duomenų buferio našumo išoriniame tinkle.","B",""
"Kaip vizualizuojamas kubito sužadinimas atominės struktūros pavyzdyje siekiant gauti superpoziciją |0⟩ + |1⟩?","Elektronas paveikiamas lazeriu/šviesa, priverčiant jį būti tarpinėje stadijoje: iš dalies sužadintoje (išorinėje orbitoje) ir iš dalies nesužadintoje (vidinėje orbitoje) būsenoje vienu metu.","Atomas panardinamas į skystą helį, kurio molekulės užrakina elektroną tiksliai branduolio centre ir apverčia jo ašį.","Elektronas padalinamas pusiau skalpeliu, kur viena pusė virsta protonu (|1⟩), o kita lieka elektronu (|0⟩).","Fotonas pagreitinamas iki šviesos greičio, dėl ko jis sukuria antrąją savo kopiją kitoje virtualioje dėžutėje.","A",""
"Pasirinkite teisingą „Photonic circuits“ (fotoninių grandinių) tipo kubitų savybę iš žemiau pateiktų:","Ši technologija leidžia matuoti kubitų tarpines būsenas neprarandant superpozicijos dėl fotonų išlenktos gravitacijos.","Jie reikalauja didžiausio aušinimo iš visų tipų, nes fotonai išlydo silicio grandines dirbdami be azoto aušinimo.","Fotonas neturi masės nei krūvio, todėl jo beveik neveikia aplinka ir jam nereikia ypatingų (ekstremalaus šalčio) sąlygų.","Jie naudoja radijo bangas atsitiktinių skaičių generavimui uždarame Faraday narve per magnetinį lauką.","C",""
"Kas atsitinka kubitui kvantinėje grandinėje, kai jam pritaikomas matavimo (Measurement) blokas?","Kubitas pereina į aukštesnį energijos lygmenį ir tampa tobulu fotonu, keliaujančiu per skaičiavimo magistralę be pasipriešinimo.","Matavimo blokas veikia kaip atminties buferis, išsaugodamas kubito superpoziciją neribotam laikui standžiajame SSD diske.","Kubitas dauginasi, sukurdamas savo paties kopijas, atitinkančias visus įmanomus atsakymų variantus C++ išvedimo masyve.","Kubito kvantinė būsena kolapsuoja (redukuojasi), superpozicija yra sunaikinama, ir kubitas pavirsta į apibrėžtą klasikinį bitą (0 arba 1).","D",""
"Kurie algoritmai ir taikymo sritys yra ypač perspektyvūs, pasitelkiant kvantinių kompiuterių pranašumą? (Pasirinkite visus teisingus atsakymus)","Optimizacijos, finansų ir logistikos uždaviniai (paieška didžiulėse skaičiavimų duomenų aibėse).","Tradicinis vaizdo žaidimų grafikos renderinimas (pvz., aukšto FPS pasiekimas dvigubu vaizdo buferizavimu).","Kriptografija (didelių skaičių skaidymas į pirminius daugiklius ir RSA šifrų nulaužimas).","Chemija ir medicina (sudėtingų molekulių struktūrų ir reakcijų tikslus modeliavimas).","A,C,D",""
"1935 metais suformuluotas „EPR paradoksas“. Su kokia kvantine savybe jis tiesiogiai susijęs?","Pirmaisiais šviesolaidžiais perduodamais fotonų lazerio impulsais atominėse elektrinėse.","Blocho sferos matematinio vektorinio modulio nebaigtumu įrodant Tiuringo mašinų skaičiavimus.","Bangų-dalelių dualumu ir interferencija moksliniuose eksperimentuose su dviejų plyšių plokštėmis.","Kvantiniu susietumu (Entanglement), kai dalelės reaguoja viena į kitą nepaaiškinamai greitai dideliu atstumu.","D",""
"Kaip vadinasi IBM kompanijos platforma/programa (matoma skaidrėse), leidžianti naršyklės grafinėje sąsajoje kurti kvantines grandines, dėlioti loginius vartus ir jas simuliuoti?","Google Sycamore Lab Cloud","IBM Quantum Composer","Intel Quantum SDK Interface","IBM Quantum Virtual Machine (QVM)","B",""
"Kokia loginio elemento „Toffoli“ (CCX arba CCNOT) pagrindinė paskirtis kvantinėje architektūroje?","Jis veikia kaip paprastas klasikinis „OR“ elementas – atstato būsenas praradus superpoziciją į |0⟩ bazę.","Tai trigubas loginis elementas, kuris apverčia trečiojo (Target) kubito būseną tik tuo atveju, jeigu abiejų pirmųjų dviejų (Control) kubitų reikšmės yra tiksliai 1.","Jis automatiškai išmatuoja ir išveda visų sistemos kubitų reikšmes vienu metu į dvimatį ekraną.","Tai fizinis izoliacijos vartų mechanizmas, neleidžiantis kvantinei dekoherencijai sugriauti sistemos aušinimo.","B",""
"Tarkime, turite grandinę, kur kubitui iš pradinės būsenos |0⟩ pritaikomi Hadamard (H) vartai, o tada nedelsiant atliekamas matavimas (Z). Kokia bus tikimybė gauti rezultatą 1?","Gausime atsakymą 2, nes Hadamard vartai teoriškai dvigubina kubito vertę lyginant su standartine matrica.","100%, nes Hadamard vartai yra iš esmės lygiai tas pats kas klasikiniai X (NOT) loginiai vartai.","0%, nes po bet kokio matavimo kubitas visada grįžta į pradinę |0⟩ energijos būseną ir išsijungia.","Tiksliai 50% (0.5), nes Hadamard sukuria absoliučiai tolygią dviejų būsenų superpoziciją.","D",""
"Jeigu kompaso metaforos pavyzdyje kubitas yra būsenoje, kurioje šiaurė (1) atitinka 0.64 tikimybę, o pietūs (0) atitinka 0.36 tikimybę, kas nutiks atlikus tiksliai šios būsenos kubito matavimą didelį kiekį kartų?","Kiekvieną kartą atliekant matavimą procesoriaus rezultatas ekrane bus visada skaičius 0.64.","Kubitas po pirmo matavimo susikels į 1 vertę, ir pirmus 36 kartus rodys 1, o sekančius 64 kartus 0 išlaikant eiliškumą.","Apytiksliai 64% visų atliktų matavimų rezultatų sugrąžins skaičių 1, o 36% sugrąžins skaičių 0.","Matavimas aparatūroje nepavyks, nes kvantinė tikimybių suma viršija nustatytą kvantinę konstantą π.","C",""
"Pagal skaidrėse pateiktą grafiką, kaip apytiksliai kito pasaulinis susidomėjimas ir įkurtų kvantinių organizacijų (Quantum Organizations) kiekis nuo 2002 m. iki 2019-2022 m.?","Nuo 2013-2015 m. matomas staigus eksponentinis šuolis, kur įkurtų organizacijų skaičius per metus išaugo kelis kartus, pasiekdamas globalų piką apie 2019 metus.","Daugiausia kvantinių įmonių buvo įkurta išimtinai apie 1980 m. po Feynman'o kalbos, o 2019 m. fiksuotas tik bankrotų bumas.","Kvantinių organizacijų pasaulyje egzistuoja ir dominuoja tik trys: IBM, Google ir D-Wave, daugiau inovatyvių įmonių nebuvo įkurta.","Nuo 2002 m. iki 2022 m. organizacijų skaičius nuosekliai ir tiesiškai mažėjo, kol pasaulinė rinka visiškai prarado susidomėjimą.","A",""
"Kodėl Šriodingerio katino eksperimento idėja („ir gyvas, ir miręs“) yra itin svarbi aiškinant kvantinę kompiuteriją vartotojams? (Pasirinkite visus teisingus atsakymus)","Ji atskleidžia realų fizikinį faktą, jog kvantiniai kompiuteriai privalo būti statomi iš biologinių neuronų tinklų ir gyvūnų DNR ląstelių atliekant C++ kodo matavimus.","Ji puikiai iliustruoja makroskopinę superpozicijos analogiją – sistemos būsena išlieka neapibrėžta ir talpina visas įmanomas išeitis vienu metu.","Eksperimentas matematiškai įrodo, kad visos sintaksės klaidos (bugs) koduose savaime išsitaiso, jeigu programuotojas tiesiogiai nežiūri į monitorių proceso metu.","Ji padeda suvokti matavimo akto (dėžės atidarymo) reikšmę: tik sąveikaujant su stebėtoju kvantinė banginė būsena kolapsuoja į konkretų apibrėžtą atsakymą.","B,D",""
"Kas žymima ir pavaizduojama Blocho sferoje (Bloch sphere) naudojant trijų dimensijų x, y ir z ašis bei kampus θ ir φ?","Viso globalaus kvantinio kompiuterio kietojo disko (HDD) talpos ir magnetinių sektorių apskaičiavimo sferinė diagrama informatikams.","Tai erdvinis geometrinis kubito banginės funkcijos (būsenos |ψ⟩) atvaizdavimas, padedantis vizualizuoti superpoziciją ir kompleksines amplitudes sistemoje.","Traektorija, kuria mikroskopinis fotonas juda 3D erdvėje iki atsitrenkimo į ekraną Feynman'o dviejų plyšių lazeriniame eksperimente.","Fizinio atvėsinto kvantinio procesoriaus išorinis sferinis apvalkalas ir jo tvirtinimo ašys (x,y,z) realiose laboratorijose atlaikyti gravitacijai.","B",""
"Kurį iš šių algoritmų kvantinis kompiuteris spręstų visiškai neefektyviai, ir greičiausiai veiktų prasčiau ar taip pat lėtai kaip ir paprastas klasikinis namų kompiuteris?","Labai sudėtingos vaisto cheminės molekulės modeliavimas superpozicijoje, simuliuojant atomų ir elektronų ryšius erdvėje.","Asimetrinio RSA šifravimo privačiojo rakto iškodavimas ir milžiniškų skaičių pirminių daugiklių dekonstrukcija internete.","Geriausio ir pigiausio maršruto paieška (optimizavimas) tūkstančių mazgų realaus laiko pasaulinės logistikos tinkle.","Nuoseklus, paprastas sąlyginis if/else failų apdorojimas tekstiniame dokumente, kur nėra jokių sudėtingų paieškų ar paralelių tiesinių problemų.","D",""
"Kokia teorinė technologija vizualizuojama Intel „Full Stack Approach“ (pilno steko) schemoje skaidrėse, skirta efektyviai bendrauti tarp klasikinės ir kvantinės aparatinės įrangos valdiklių?","Analoginių vakuumo vamzdžių sistema, atkurianti klasikinio ENIAC kompiuterio logiką moderniame kvantiniame fotonų lygmenyje šaldytuvuose.","DNR sekų analizatorius, skaitantis ir modifikuojantis biochemines reakcijas atominio laikrodžio greičiu pritaikant Josephson junction modulius.","Fotoninių šviesolaidžių modemas su įmontuotu belaidžiu 5G tinklu, išmaniai blokuojantis visus foninius kvantinius matavimo triukšmus kosmose.","Kambario temperatūroje veikiantis elektronikos „Horse Ridge II Control Chip“ lustas ir „C++ Quantum Compiler“ programinė įranga.","D",""
"Kokia esminė fizikos izoliacijos problema, stabdanti masinę kvantinių kompiuterių gamybą, yra akcentuojama inžinierių skaidrėse?","Kvantinė informacija ir jos superpozicija yra ypatingai trapi; kubitai privalo būti pilnai ir hermetiškai atskirti nuo šilumos, elektromagnetinių laukų ir bet kokių išorės elementų trikdžių, antraip iššaukiama dekoherencija.","Kubitai taip stipriai magnetizuojasi besisukdami Blocho sferoje, kad tiesiog ištraukia vinis iš sienų ir deformuoja laboratorijos pastato architektūrines struktūras.","Kvantinių procesorių sukuriamas radijo triukšmas akimirksniu pažeidžia visą klasikinę elektroniką 100 metrų spinduliu, tad serverius tenka privalomai laidoti po žeme kalnuose.","Inžinerinė izoliacija reikalinga išimtinai ir tik tam, kad internetiniai hakeriai Wi-Fi tinklu nepavogtų jūsų atliekamų slaptų kvantinių skaičiavimų radijo bangų signalais.","A",""
"Kaip skiriasi kvantinio bito bazinės būsenos |1⟩ reprezentacija matricinėje algebroje, lyginant ją su loginio elemento Pauli-X matrica?","Būsena |1⟩ išreiškiama tiesiog paprastu skaičiumi 1 kompiuterio atmintyje, o Pauli-X atitinka nerealistinę kvadratinę lygtį x^2 = -1.","Būsena |1⟩ yra atvaizduojama begalybės simboliu informatikos teorijoje, o Pauli-X vaizduojamas tiesiog raide X virtualiose mašinose.","Būsena |1⟩ išreiškiama tiesiniu stulpeliniu vektoriumi [0, 1]^T, o tuo tarpu Pauli-X (NOT) vartai išreiškiami 2x2 operacine matrica [0 1; 1 0].","Tiek bazinė būsena, tiek loginis elementas Pauli-X operacijų lange išreiškiami visiškai identiška ir vienoda Hadamard interferencine matrica.","C",""
"Kokios yra žinomos ir populiarios „Daugelio pasaulių interpretacijos“ (Many-worlds interpretation) teorinės pasekmės kvantinės mechanikos eksperimentuose (kaip pvz. su katinu)?","Tai įrodytas praktinis inžinerijos būdas, tiesiogiai interneto magistralėmis peržengti laiko ir erdvės ribas bendraujant su kitomis saulės sistemų planetomis.","Tai teorinė kvantinės fizikos interpretacija teigianti, kad matavimo akto metu banginė funkcija iš tikrųjų nesugriūva, o pati visata paraleliai pasidalina į atskiras lygiagrečias realybes kiekvienam galimam matavimo (būsenos) rezultatui.","Tai programinis metodas, leidžiantis programuotojams dirbant su IBM kvantiniais kompiuteriais sėkmingai paleisti ir simuliuoti kelias skirtingas programas Linux operacinės sistemos branduolyje.","Tai fundamentali loginė klaida Paul Benioff Tiuringo mašinos modelyje, kurią galiausiai išsprendė ir atitaisė Peter Shor naudodamas savo priminių daugiklių algoritmą 1994 metais.","B",""
"Kaip kvantinėje kompiuterijoje vadinamas loginis elementas CZ (Controlled Z), ir kokį konkretų funkcinį poveikį jis atlieka grandinėje?","Jis komandoje automatiškai ištrina ir nulina abu sujungtus kubitus paverčiant juos lygiai |0⟩ būsenos klasikiniais bitais be superpozicijos pėdsakų.","Tai virtualus programinis izoliacinis sluoksnis kode, griežtai saugantis sistemą nuo kvantinio susietumo atsitiktinumų generuojant skaičius.","Jis tiesiogiai sukeičia (SWAP komanda) dviejų pasirinktų kubitų reikšmes vietomis visiškai nepriklausomai nuo jų superpozicijos ar interferencijos lygio sistemoje.","Jis pritaiko Pauli-Z (Z) fazės poslinkio matricos operaciją pasirinktam antrajam (Target) kubitui tik tokiu atveju, jeigu pirmojo (Control) kubito būsena yra lygi 1.","D",""
"Jeigu turime kvantinę sistemą sudarytą iš griežtai N=3 kubitų. Kiek maksimaliai skirtingų klasikinių bazinių būsenų galėtų egzistuoti tokios sistemos globalioje superpozicijoje vienu metu?","3 skirtingos būsenos (nes kubitai veikia tik tiesiškai pavieniui kompiuteryje be susietumo galimybių).","8 skirtingos būsenos (nes 2 pakelta 3-iuoju laipsniu yra 8).","9 skirtingos būsenos (nes 3 pakelta kvadratu yra lygiai 9).","6 skirtingos būsenos (nes 3 kubitai padauginti iš 2 galimų verčių lygus 6).","B",""
"Remiantis IBM Quantum Roadmap diagrama (pateikta skaidrėje 'Raida – šiuo metu..'), kokį kvantinį superkompiuterį su kokia neįtikėtina elementų apimtimi korporacija planuoja sukurti apie 2033 metus?","„100,000-qubit quantum-centric supercomputer“ (milžinišką 100 tūkstančių kubitų skaičiavimo klasterio tinklą).","Visiškai tobulą 54-kubitų Sycamore kompiuterį gebantį autonomiškai veikti standartiniame žmogaus mobiliajame telefone išnaudojant 5G.","433 kubitų kompiuterį, kuris bus visiškai pritaikytas pakeisti stalinius PC asmeniniam kasdieniam vartotojų naudojimui biuruose ir namuose.","Sukurti neribotos apimties (infinity-qubit) kvantinį debesų (Cloud) kompiuterį veikiantį be jokių optinių kabelių ar skysto azoto šaldymo įrenginių pramonėje.","A",""
"Apibendrinant visą kvantinės kompiuterijos filosofiją ir fizikos principus – kuris iš šių žemiau pateiktų teiginių yra labiausiai KLAIDINGAS remiantis paskaitos medžiaga?","Kvantinis kompiuteris technologiškai yra lygiai tas pats kaip ir labai galingas įprastas kompiuteris, skirtumas tas, jog jis naudoja greitus optinius šviesolaidžius vietoje laidų bei didesnį RAM taktą konvejeryje.","Kvantinis susietumas (entanglement) leidžia modifikuoti vieno kubito būseną, kas neatsiejamai ir akimirksniu paveikia ir modifikuoja su juo susieto kito kubito būseną tikimybinėje erdvėje.","Kvantinio kompiuterio algoritmai remiasi atsitiktinumo ir tikimybių fizikos (kvantinės mechanikos) principais, o ne deterministiniais aiškiais 1 ir 0 klasikiniais skaičiavimais.","Nors kvantinis kompiuteris teoriškai yra neįtikėtinai galingas tam tikrose srityse, išvedimo (matavimo kolapso) ir dekoherencijos problemos vis dar stipriai riboja jo masišką komercinį pritaikomumą buityje.","A",""
